{
  "schema_version": 1,
  "type": "node",
  "lifecycle": "experimental",
  "maturity": "prototype",
  "workflow": "multi-lane",
  "anchoring": "strict",
  "ground_truth_boundary": { "forge": "github", "default_branch": "main" },
  "lanes": { "namespace": "lane/*", "lease_ttl": "7d" },
  "join_keys": ["Baseline-Agent", "Baseline-Issue"]
}
