{
  "schema_version": 1,
  "type": "docs",
  "lifecycle": "production",
  "maturity": "released",
  "workflow": "multi-lane",
  "anchoring": "strict",
  "lanes": { "namespace": "lane/*", "lease_ttl": "7d", "families": ["adopt/*"] },
  "join_keys": ["Baseline-Agent", "Baseline-Issue"],
  "ground_truth_boundary": { "forge": "github", "default_branch": "main" }
}
